<!DOCTYPE scripts SYSTEM "scriptella.dtd">
<scripts>
    <connection driver="---" url="---" user="" password=""/>
    <script>
        <include href="XIncludeTest.sql"/>
    </script>
    <script>
        <include href="xinctst/XIncludeTest.sql"/>
    </script>
    <script>
        --Sample1--
        <include href="XIncludeTest.sql"/>
        --Sample2--
    </script>
    <script>
        <include href="nosuchurl">
            <fallback>Fallback!</fallback>
        </include>
    </script>


</scripts>